{
  "format_version": 1,
  "name": "content-version-conversion-without-deflator",
  "description": "A conversion record carrying only the required recipe and rate_table_version members, with no deflator table joined, mints a content_version distinct from the same recipe/rate pair paired with a deflator_table_version.",
  "kind": "content_version",
  "classification": "positive",
  "coverage": [
    "preimage.conversion.without-deflator"
  ],
  "frame_sha256": "5ab15c244a9615f97c666d097a25fdfc99797790ecd883ab7a8258c4944a0c12",
  "content_version_input": {
    "graph_revision": "graph-rev-2024-03",
    "source_revisions": [
      {
        "source": "OECD_DAC_CRS",
        "revision": "rev-9"
      }
    ],
    "facets": [
      {
        "axis": "measurementMethod",
        "ref": "dcid:MeasuredAtSource",
        "basis": "bound"
      }
    ],
    "conversion": {
      "recipe": "fx_convert",
      "rate_table_version": "fx-2024-03"
    }
  },
  "expected_preimage": {
    "identity_version": "cv1",
    "frame_sha256": "5ab15c244a9615f97c666d097a25fdfc99797790ecd883ab7a8258c4944a0c12",
    "graph_revision": "graph-rev-2024-03",
    "source_revisions": [
      {
        "source": "OECD_DAC_CRS",
        "revision": "rev-9"
      }
    ],
    "facets": [
      {
        "axis": "measurementMethod",
        "ref": "dcid:MeasuredAtSource",
        "basis": "bound"
      }
    ],
    "conversion": {
      "recipe": "fx_convert",
      "rate_table_version": "fx-2024-03"
    }
  },
  "expected_content_version": "cv_fb7a71b0825644369832ded7439da3fb"
}
