{
  "format_version": 1,
  "name": "frame-multi-source-multi-facet-input-order-converges",
  "description": "Three source_revisions entries and two facets entries, in a fixed input order. Deliberately shares its expected content_version with frame-multi-source-multi-facet-shuffled-converges: array input order carries no meaning for either array.",
  "kind": "frame",
  "classification": "positive",
  "coverage": [
    "content-version.source-revisions-order-independent",
    "content-version.facets-order-independent"
  ],
  "role_keys": [
    "provider",
    "recipient"
  ],
  "rows": [
    {
      "stat_var": "dcid:MalariaGrantDisbursements",
      "provider": "country/FRA",
      "recipient": "country/TGO",
      "time_period": "2015",
      "value": 1000.0,
      "unit": "USD",
      "measurementMethod": "GrantEquivalent",
      "provenance": "OECD_DAC2A"
    }
  ],
  "expected_columns": [
    "stat_var",
    "provider",
    "recipient",
    "time_period",
    "value",
    "unit",
    "measurementMethod",
    "provenance",
    "status"
  ],
  "canonical_bytes": "7b22636f6c756d6e73223a5b22737461745f766172222c2270726f7669646572222c22726563697069656e74222c2274696d655f706572696f64222c2276616c7565222c22756e6974222c226d6561737572656d656e744d6574686f64222c2270726f76656e616e6365222c22737461747573225d2c226672616d655f76657273696f6e223a226672616d6531222c22726f7773223a5b5b22646369643a4d616c617269614772616e7444697362757273656d656e7473222c22636f756e7472792f465241222c22636f756e7472792f54474f222c2232303135222c313030302c22555344222c224772616e744571756976616c656e74222c224f4543445f4441433241222c6e756c6c5d5d7d",
  "expected_document": {
    "columns": [
      "stat_var",
      "provider",
      "recipient",
      "time_period",
      "value",
      "unit",
      "measurementMethod",
      "provenance",
      "status"
    ],
    "frame_version": "frame1",
    "rows": [
      [
        "dcid:MalariaGrantDisbursements",
        "country/FRA",
        "country/TGO",
        "2015",
        1000,
        "USD",
        "GrantEquivalent",
        "OECD_DAC2A",
        null
      ]
    ]
  },
  "expected_frame_sha256": "2e1c4c00c64cbb3736431f1144bd08190390dea5967e80f6fb5d97ce07c92eea",
  "content_version_input": {
    "graph_revision": "graph-rev-2024-01",
    "source_revisions": [
      {
        "source": "OECD_DAC_CRS",
        "revision": "rev-7"
      },
      {
        "source": "WORLD_BANK_WDI",
        "revision": "rev-3"
      },
      {
        "source": "IMF_GFS",
        "revision": "rev-1"
      }
    ],
    "facets": [
      {
        "axis": "provenance",
        "ref": "OECD_DAC2A",
        "basis": "bound"
      },
      {
        "axis": "measurementMethod",
        "ref": "GrantEquivalent",
        "basis": "bound"
      }
    ]
  },
  "expected_preimage": {
    "identity_version": "cv1",
    "frame_sha256": "2e1c4c00c64cbb3736431f1144bd08190390dea5967e80f6fb5d97ce07c92eea",
    "graph_revision": "graph-rev-2024-01",
    "source_revisions": [
      {
        "source": "IMF_GFS",
        "revision": "rev-1"
      },
      {
        "source": "OECD_DAC_CRS",
        "revision": "rev-7"
      },
      {
        "source": "WORLD_BANK_WDI",
        "revision": "rev-3"
      }
    ],
    "facets": [
      {
        "axis": "measurementMethod",
        "ref": "GrantEquivalent",
        "basis": "bound"
      },
      {
        "axis": "provenance",
        "ref": "OECD_DAC2A",
        "basis": "bound"
      }
    ]
  },
  "expected_content_version": "cv_2bc382bfb068ba26c892403329485385"
}
