{
  "format_version": 1,
  "name": "frame-time-period-interval-year",
  "description": "A year-grain ISO 8601 interval time_period (2018/2022) is carried verbatim as one string cell.",
  "kind": "frame",
  "classification": "positive",
  "coverage": [
    "cell-domains.time-period-interval",
    "content-version.mint"
  ],
  "role_keys": [
    "provider"
  ],
  "rows": [
    {
      "stat_var": "dcid:MalariaGrantDisbursements",
      "provider": "country/FRA",
      "time_period": "2018/2022",
      "value": 5000
    }
  ],
  "expected_columns": [
    "stat_var",
    "provider",
    "time_period",
    "value",
    "unit",
    "measurementMethod",
    "provenance",
    "status"
  ],
  "canonical_bytes": "7b22636f6c756d6e73223a5b22737461745f766172222c2270726f7669646572222c2274696d655f706572696f64222c2276616c7565222c22756e6974222c226d6561737572656d656e744d6574686f64222c2270726f76656e616e6365222c22737461747573225d2c226672616d655f76657273696f6e223a226672616d6531222c22726f7773223a5b5b22646369643a4d616c617269614772616e7444697362757273656d656e7473222c22636f756e7472792f465241222c22323031382f32303232222c353030302c6e756c6c2c6e756c6c2c6e756c6c2c6e756c6c5d5d7d",
  "expected_document": {
    "columns": [
      "stat_var",
      "provider",
      "time_period",
      "value",
      "unit",
      "measurementMethod",
      "provenance",
      "status"
    ],
    "frame_version": "frame1",
    "rows": [
      [
        "dcid:MalariaGrantDisbursements",
        "country/FRA",
        "2018/2022",
        5000,
        null,
        null,
        null,
        null
      ]
    ]
  },
  "expected_frame_sha256": "f555d1f4f3acaedfca92249a4ef8e9139b722ed447a3b0a5d1f8d31a95f705b4",
  "content_version_input": {
    "graph_revision": "graph-rev-2024-01",
    "source_revisions": [
      {
        "source": "OECD_DAC_CRS",
        "revision": "rev-7"
      }
    ],
    "facets": []
  },
  "expected_preimage": {
    "identity_version": "cv1",
    "frame_sha256": "f555d1f4f3acaedfca92249a4ef8e9139b722ed447a3b0a5d1f8d31a95f705b4",
    "graph_revision": "graph-rev-2024-01",
    "source_revisions": [
      {
        "source": "OECD_DAC_CRS",
        "revision": "rev-7"
      }
    ],
    "facets": []
  },
  "expected_content_version": "cv_e9e0d0c453b104c7e3ca27d5d87134ad"
}
