{
  "format_version": 1,
  "name": "frame-unicode-precomposed-converges",
  "description": "The same provenance facet ref as frame-unicode-decomposed-converges, already NFC-composed at the input boundary.",
  "kind": "frame",
  "classification": "positive",
  "coverage": [
    "frame.unicode.nfc-convergence"
  ],
  "role_keys": [
    "provider",
    "recipient"
  ],
  "rows": [
    {
      "stat_var": "dcid:MalariaGrantDisbursements",
      "provider": "country/FRA",
      "recipient": "country/TGO",
      "time_period": "2015",
      "value": 1.0,
      "provenance": "café"
    }
  ],
  "expected_columns": [
    "stat_var",
    "provider",
    "recipient",
    "time_period",
    "value",
    "unit",
    "measurementMethod",
    "provenance",
    "status"
  ],
  "canonical_bytes": "7b22636f6c756d6e73223a5b22737461745f766172222c2270726f7669646572222c22726563697069656e74222c2274696d655f706572696f64222c2276616c7565222c22756e6974222c226d6561737572656d656e744d6574686f64222c2270726f76656e616e6365222c22737461747573225d2c226672616d655f76657273696f6e223a226672616d6531222c22726f7773223a5b5b22646369643a4d616c617269614772616e7444697362757273656d656e7473222c22636f756e7472792f465241222c22636f756e7472792f54474f222c2232303135222c312c6e756c6c2c6e756c6c2c22636166c3a9222c6e756c6c5d5d7d",
  "expected_document": {
    "columns": [
      "stat_var",
      "provider",
      "recipient",
      "time_period",
      "value",
      "unit",
      "measurementMethod",
      "provenance",
      "status"
    ],
    "frame_version": "frame1",
    "rows": [
      [
        "dcid:MalariaGrantDisbursements",
        "country/FRA",
        "country/TGO",
        "2015",
        1,
        null,
        null,
        "café",
        null
      ]
    ]
  },
  "expected_frame_sha256": "c2808e66cca8b9c02c409a72dcac1cf93c6f7f00befebabd4e520f220b3e7605",
  "content_version_input": {
    "graph_revision": "graph-rev-2024-01",
    "source_revisions": [],
    "facets": []
  },
  "expected_preimage": {
    "identity_version": "cv1",
    "frame_sha256": "c2808e66cca8b9c02c409a72dcac1cf93c6f7f00befebabd4e520f220b3e7605",
    "graph_revision": "graph-rev-2024-01",
    "source_revisions": [],
    "facets": []
  },
  "expected_content_version": "cv_35cddb0b1d56c48bd69688668e9430f7"
}
