{
  "format_version": 1,
  "name": "content-version-conversion-trace-entry-with-deflator",
  "description": "A manifest trace's one-entry conversion array, carrying recipe, rate_table_version, and deflator_table_version beside the trace-only members, fallback, and projected, builds the same preimage and content_version as the same record supplied as an object (content-version-conversion-with-deflator).",
  "kind": "content_version",
  "classification": "positive",
  "coverage": [
    "preimage.conversion.trace-entry",
    "preimage.conversion.with-deflator"
  ],
  "frame_sha256": "be8669d8c7d277111c3dbb027e8057904f80c13a5de9ab4132e010650bf85fb4",
  "content_version_input": {
    "graph_revision": "graph-rev-2024-02",
    "source_revisions": [
      {
        "source": "OECD_DAC_CRS",
        "revision": "rev-9"
      }
    ],
    "facets": [
      {
        "axis": "measurementMethod",
        "ref": "dcid:MeasuredAtSource",
        "basis": "bound"
      }
    ],
    "conversion": [
      {
        "recipe": "fx_deflate_convert",
        "rate_table_version": "fx-2024-02",
        "deflator_table_version": "defl-2024-02",
        "members": [
          {
            "stat_var": "dcid:sv_a",
            "native_unit": "dcid:EUR"
          }
        ],
        "fallback": {
          "count": 0,
          "examples": [],
          "truncated": false
        },
        "projected": {
          "count": 1,
          "examples": [
            "2025"
          ],
          "truncated": false
        }
      }
    ]
  },
  "expected_preimage": {
    "identity_version": "cv1",
    "frame_sha256": "be8669d8c7d277111c3dbb027e8057904f80c13a5de9ab4132e010650bf85fb4",
    "graph_revision": "graph-rev-2024-02",
    "source_revisions": [
      {
        "source": "OECD_DAC_CRS",
        "revision": "rev-9"
      }
    ],
    "facets": [
      {
        "axis": "measurementMethod",
        "ref": "dcid:MeasuredAtSource",
        "basis": "bound"
      }
    ],
    "conversion": {
      "recipe": "fx_deflate_convert",
      "rate_table_version": "fx-2024-02",
      "deflator_table_version": "defl-2024-02"
    }
  },
  "expected_content_version": "cv_ae41e775e662fd84f2f0dfb05963c81b"
}
