{
  "format_version": 1,
  "name": "content-version-conversion-with-deflator",
  "description": "A conversion record carrying recipe, rate_table_version, and deflator_table_version mints a content_version that digests all three members, independent of any specific frame.",
  "kind": "content_version",
  "classification": "positive",
  "coverage": [
    "preimage.conversion.with-deflator"
  ],
  "frame_sha256": "be8669d8c7d277111c3dbb027e8057904f80c13a5de9ab4132e010650bf85fb4",
  "content_version_input": {
    "graph_revision": "graph-rev-2024-02",
    "source_revisions": [
      {
        "source": "OECD_DAC_CRS",
        "revision": "rev-9"
      }
    ],
    "facets": [
      {
        "axis": "measurementMethod",
        "ref": "dcid:MeasuredAtSource",
        "basis": "bound"
      }
    ],
    "conversion": {
      "recipe": "fx_deflate_convert",
      "rate_table_version": "fx-2024-02",
      "deflator_table_version": "defl-2024-02"
    }
  },
  "expected_preimage": {
    "identity_version": "cv1",
    "frame_sha256": "be8669d8c7d277111c3dbb027e8057904f80c13a5de9ab4132e010650bf85fb4",
    "graph_revision": "graph-rev-2024-02",
    "source_revisions": [
      {
        "source": "OECD_DAC_CRS",
        "revision": "rev-9"
      }
    ],
    "facets": [
      {
        "axis": "measurementMethod",
        "ref": "dcid:MeasuredAtSource",
        "basis": "bound"
      }
    ],
    "conversion": {
      "recipe": "fx_deflate_convert",
      "rate_table_version": "fx-2024-02",
      "deflator_table_version": "defl-2024-02"
    }
  },
  "expected_content_version": "cv_ae41e775e662fd84f2f0dfb05963c81b"
}
