{
  "format_version": 1,
  "name": "frame-row-order-input-converges",
  "description": "Four rows in their natural (ascending time_period) order. Row order in the input carries no meaning; this vector and frame-row-order-shuffled-converges must mint identical canonical_bytes and content_version.",
  "kind": "frame",
  "classification": "positive",
  "coverage": [
    "frame.row-order.input-independent"
  ],
  "role_keys": [
    "provider",
    "recipient"
  ],
  "rows": [
    {
      "stat_var": "dcid:MalariaGrantDisbursements",
      "provider": "country/FRA",
      "recipient": "country/TGO",
      "time_period": "2015",
      "value": 15.0
    },
    {
      "stat_var": "dcid:MalariaGrantDisbursements",
      "provider": "country/FRA",
      "recipient": "country/TGO",
      "time_period": "2016",
      "value": 16.0
    },
    {
      "stat_var": "dcid:MalariaGrantDisbursements",
      "provider": "country/FRA",
      "recipient": "country/TGO",
      "time_period": "2017",
      "value": 17.0
    },
    {
      "stat_var": "dcid:MalariaGrantDisbursements",
      "provider": "country/FRA",
      "recipient": "country/TGO",
      "time_period": "2018",
      "value": 18.0
    }
  ],
  "expected_columns": [
    "stat_var",
    "provider",
    "recipient",
    "time_period",
    "value",
    "unit",
    "measurementMethod",
    "provenance",
    "status"
  ],
  "canonical_bytes": "7b22636f6c756d6e73223a5b22737461745f766172222c2270726f7669646572222c22726563697069656e74222c2274696d655f706572696f64222c2276616c7565222c22756e6974222c226d6561737572656d656e744d6574686f64222c2270726f76656e616e6365222c22737461747573225d2c226672616d655f76657273696f6e223a226672616d6531222c22726f7773223a5b5b22646369643a4d616c617269614772616e7444697362757273656d656e7473222c22636f756e7472792f465241222c22636f756e7472792f54474f222c2232303135222c31352c6e756c6c2c6e756c6c2c6e756c6c2c6e756c6c5d2c5b22646369643a4d616c617269614772616e7444697362757273656d656e7473222c22636f756e7472792f465241222c22636f756e7472792f54474f222c2232303136222c31362c6e756c6c2c6e756c6c2c6e756c6c2c6e756c6c5d2c5b22646369643a4d616c617269614772616e7444697362757273656d656e7473222c22636f756e7472792f465241222c22636f756e7472792f54474f222c2232303137222c31372c6e756c6c2c6e756c6c2c6e756c6c2c6e756c6c5d2c5b22646369643a4d616c617269614772616e7444697362757273656d656e7473222c22636f756e7472792f465241222c22636f756e7472792f54474f222c2232303138222c31382c6e756c6c2c6e756c6c2c6e756c6c2c6e756c6c5d5d7d",
  "expected_document": {
    "columns": [
      "stat_var",
      "provider",
      "recipient",
      "time_period",
      "value",
      "unit",
      "measurementMethod",
      "provenance",
      "status"
    ],
    "frame_version": "frame1",
    "rows": [
      [
        "dcid:MalariaGrantDisbursements",
        "country/FRA",
        "country/TGO",
        "2015",
        15,
        null,
        null,
        null,
        null
      ],
      [
        "dcid:MalariaGrantDisbursements",
        "country/FRA",
        "country/TGO",
        "2016",
        16,
        null,
        null,
        null,
        null
      ],
      [
        "dcid:MalariaGrantDisbursements",
        "country/FRA",
        "country/TGO",
        "2017",
        17,
        null,
        null,
        null,
        null
      ],
      [
        "dcid:MalariaGrantDisbursements",
        "country/FRA",
        "country/TGO",
        "2018",
        18,
        null,
        null,
        null,
        null
      ]
    ]
  },
  "expected_frame_sha256": "0fd44c9a43efeb39cd429ee46f73cc54cc7fc41e25981725b9059b528fde140c",
  "content_version_input": {
    "graph_revision": "graph-rev-2024-01",
    "source_revisions": [
      {
        "source": "OECD_DAC_CRS",
        "revision": "rev-7"
      }
    ],
    "facets": []
  },
  "expected_preimage": {
    "identity_version": "cv1",
    "frame_sha256": "0fd44c9a43efeb39cd429ee46f73cc54cc7fc41e25981725b9059b528fde140c",
    "graph_revision": "graph-rev-2024-01",
    "source_revisions": [
      {
        "source": "OECD_DAC_CRS",
        "revision": "rev-7"
      }
    ],
    "facets": []
  },
  "expected_content_version": "cv_1623fd95bcc417d598bf54c19874ed12"
}
